id,sku,short_description,price,list_price,price_usd,discount,discount_rate,review_count,order_count,inventory_status,is_visible,stock_item_qty,stock_item_max_sale_qty,product_name,brand_id,brand_name
73124602,7494611465205,Bình Giữ Nhiệt Thép Không Gỉ Vacuum Bottle Lock&Lock LHC6180FU (800ml) thiết kế xách tay dễ dàng cho việc mang theo. Màu sắc nổi bật mang đển cảm giác trẻ trung khi sử dụng.Bình giữ nhiệt mang tí...,336000,677000,,341000,50,6574,,available,,1000,1000,,48077,LocknLock
53583472,4451468802389,"Bộ Hộp Cơm Giữ Nhiệt Lock&Lock Easy Carry 2L LHC8039 Có Túi (1 Hộp 720ml, 2 Hộp 420ml Kèm 1 Bộ Muỗng Và Nĩa) được làm bằng chất liệu thép không gỉ cao cấp, không những bền chắc mà còn mang lại hi...",824000,1667000,,843000,51,2455,,available,,1000,1000,,48077,LocknLock
83412126,2186358773080,Bình Giữ Nhiệt Lock&Lock Energetic One-Touch Tumbler LHC3249 - 550ML với thiết kế nắp mở một chạm dễ dàng: Đẩy sang trái để mở khóa đồng thời mở nắp.Miệng cốc rộng: Dễ dàng thêm đá viên và chùi ...,261000,528000,,267000,51,3179,,available,,1000,1000,,48077,LocknLock
58804363,7785294673323,"Lực băm nghiền mạnh nhờ hoạt động bằng phương pháp xoay và ba lưỡi dao bằng thép không gỉ.Nếu bạn kéo thanh kéo nhiều lần, ba lưỡi dao sẽ quay nhanh và băm đều rau củ.Lưỡi dao bằng thép không gỉ kh...",96000,193000,,97000,50,2738,,available,,1000,1000,,48077,LocknLock
206485076,7914870955601,"Một nén hương - Một lòng thành kính. Một làn khói - Một tâm an. Hay đơn giản là sự thư giãn tịnh tâm sau 1 ngày dài làm việc căng thẳng.Bạn chọn làn khói thiên nhiên thuần khiết, làn khói an toàn cho...",27000,55000,,28000,51,97,,available,,1000,1000,,7486975,Dương Minh Since 1984
54484578,3821461114290,"MÔ TẢ SẢN PHẨM*LƯU Ý !!!: Sản phẩm có 03 phiên bản: Đèn không tích điện: cần phải cắm vào nguồn điện như: ổ điện, máy tính, sạc dự phòng mới có thể sử dụng đượcĐèn tích điện: tích hợp pin lithium...",224400,259000,,34600,13,1958,,available,,1000,1000,,835483,eLights
113224438,1069772000400,"Ruột gối nằm Microfiber LIDACO gối bông hạt 3d không xẹp lún️ Sản phẩm ruột gối nằm Microfiber LIDACO được sản xuất trên dây chuyền công nghệ hiện đại, kĩ thuật tiên tiến đảm bảo từng đường kim mũi c...",79000,125000,,46000,37,248,,available,,1000,1000,,697923,LIDACO
53789448,6888275518789,   BẠN MUỐN MUA THÊM SẢN PHẨM KHÁC CỦA PARROTI Bộ lau nhà ProMax - Size LớnThùng rác Parroti BinCọ bồn cầu Parroti Silicon Bộ cây lau nhà thông minh tự vắt Parroti ...,439000,799000,,360000,45,3599,,available,,1000,1000,,746615,Parroti
1657931,2083613875744,"Vợt Muỗi Sunhouse SHE-E250 có kiểu dáng gọn nhẹ với thiết kế lưới điện an toàn, được làm bằng 2 lớp lưới nhôm (bên ngoài) và 1 lớp lưới sắt (bên trong), giúp tiêu diệt muỗi nhanh chóng.Sản phẩm có kh...",81000,119000,,38000,32,1206,,available,,1000,1000,,41048,Sunhouse
115092053,6156159064709,"Theo các chuyên gia y tế, tối thiểu bạn nên thay ga giường, gối 1 lần/tuần. Bởi trên mặt ga giường, vỏ gối chứa vô số vi khuẩn từ tế bào chết trên da (cơ thể mất hàng triệu tế bào da mỗi ngày), phấn t...",89000,110000,,21000,19,554,,available,,1000,1000,,697923,LIDACO
186558014,6994053079370,"Combo 10 Móc Dán Tường Treo Đồ Đa Năng Siêu Chịu LựcMỗi miếng dán sử dụng keo cường lực, độ bám dính tốt, nhưng khách chỉ nên dán trên bề mặt tường mịn màng, không lồi lỗ để đảm bảo thời gian sử dụng...",19900,19900,,0,0,158,,available,,1000,1000,,5706641,NAVIVU
11488920,6235877269401,"Bình Giữ Nhiệt Lock&Lock RigaTumbler LHC4160GRN có tiết kế nhẹ, đẹp, cá tính, giữ nhiệt tốt, bền, thích hợp sử dụng như bình nước dành cho hoạt động ngoài trời! có thể mang theo bất cứ nơi đâu nh...",354000,715000,,361000,50,5890,,available,,1000,1000,,48077,LocknLock
46202190,3178844847277,"Túi lưới giặt đồ cho máy giặt bảo vệ quần áo chống biến dạng chất lượng tốt dây kéo lưới mịn Polyester nhằm bảo vệ quần áo được làm từ tơ lụa, ren, len, thổ cẩm, lông thú, gấm, cotton, … tránh bị móc ...",58800,58800,,0,0,308,,available,,1000,1000,,111461,OEM
84566545,3448170956202,Ổ cắm đa năng USB Nakagami công nghệ Nhật Bản. Sản phẩm ổ cắm điện Nakagami có thiết kế kiểu dáng nhỏ gọn có thể sử dụng đa năng cho nhiều vị trí trong gia đình bạn. Thiết kế bao gồm 2 lỗ cắm USB và ...,155000,155000,,0,0,879,,available,,1000,1000,,290071,Nakagami
71890908,5955369732589,Thùng giặt bằng nhựa chắc chắnBộ lau nhà xoay 360 độ SUNHOUSE KS-CL330S được thiết kế tiện dụng với thùng vắt làm bằng nhựa tổng hợp với 2 màu sắc bắt mắt là xanh lá cây và màu tím. Kích thước phù hợ...,293000,412000,,119000,29,418,,available,,1000,1000,,41048,Sunhouse
173211404,7514928433043,"1.Thông tin sản phẩm:- Tên sản phẩm: Ghế xoay, Ghế xoay văn phòng làm việc- Mã sản phẩm: E4928 / E4929 / E4925 / E4926G2. Thông tin chi tiết- Trọng lượng: 7.6kg - 9.1kg- Chất liệu: Chân và khung ...",899000,1618200,,719200,44,499,,available,,1000,1000,,46703,Deli
188769126,4200238996692,"Chuông cửa không dây thông minh CACAZI, chống nước khoảng cách sử dụng trong 300M, 60 loại nhạc chuông, 110 DB  Mỗi nút bấm có thể cài đặt một loại nhạc chuông khác nhau giúp chủ nhà có thể dễ d...",275000,275000,,0,0,34,,available,,1000,1000,,685485,CACAZI
11058658,3505486111914,Túi đựng rác tự phân hủy được sản xuất bởi chất liệu HDPE và Phụ gia tự hủyTúi có khả năng tự phân hủy trong môi trường tự nhiên trong thời gian ít hơn rất nhiều so với các loại túi rác thông thường ...,39000,54000,,15000,28,557,,available,,1000,1000,,288231,Titapha
186627908,4742192840663,"Ghế Gác Chân Công Thái Học, Ghế Kê Chân Văn Phòng Ergonomic Footrest Đầy Đủ Phiên Bản Ghế gác chân công thái học được nghiên cứu và thiết kế khoa học giúp nâng đỡ chân thoải mái khi làm việc, học hàn...",189000,280000,,91000,33,151,,available,,1000,1000,,111461,OEM
3480627,9330774535233,"  Bộ Cây Lau Nhà Xoay Tay Compact Spin Mop Lock&Lock ETM466: Thùng Giặt + Cây + Bông LauThùng chứa được làm bằng chất liệu nhựa PP cao cấp, chất lượng, có khả năng chịu được va đập tốt, cho độ...",475000,924000,,449000,49,1189,,available,,1000,1000,,48077,LocknLock
14640240,4167998775870,"Cân Điện Tử Nhà Bếp 5kg Hình 1:  Ảnh tổng quan sản phẩm Cân điện tử nhà bếp 5kg Cân điện tử 5kg có kích thước 16cm x 12.5cm làm từ chất liệu nhựa ABS cao cấp, màu trắng sang trọng, sạch sẽ. Cân có...",74914,74914,,0,0,1,,available,,1000,1000,,111461,OEM
27609461,9472086840343,"Dụng cụ thông tắc cống khí nén hiệu quả tuyệt đối là lựa chọn tuyệt vời cho việc thông tắc cống bồn cầu, thông tắc cống toilet, thông tắc cống bồn tắm khi bị tắc nghẽn. Máy thông tắc bồn cầu, dụng cụ ...",188000,188000,,0,0,13,,available,,1000,1000,,111461,OEM
99868980,5466758134944,"   Bình Giữ Nhiệt Locknlock Bucket Tumbler LHC4269 có tay cầm chắc chắn thuận tiện mang đi.Nắp và lưới lọc có thể tháo rời, dễ dàng vệ sinh.Miệng bình rộng đủ để vệ sinh bên trong và thêm đá v...",235000,473000,,238000,50,1988,,available,,1000,1000,,48077,LocknLock
7635008,4685277957415,Giới thiệu cuộn túi hút chân không thực phẩm dùng cho máy hút chân khôngTúi PA/PE hút chân không là các túi dùng để bảo quản thực phẩm bên trong và được xử lý theo công nghệ rút chân không bằng máy h...,60000,60000,,0,0,164,,available,,1000,1000,,111461,OEM
99994000,9415199298102,"Bình giữ nhiệt có ống hút Lock&Lock Bucket Tumbler with Straw LHC4268 thiết kế tay cầm chắc chắn giúp bạn thuận tiện mang theo mọi lúc mọi nơi.Nắp và lưới lọc có thể tháo rời, dễ dàng vệ sinh....",235000,473000,,238000,50,1227,,available,,1000,1000,,48077,LocknLock
59259444,6937793058205,"Video Chi tiết sản phẩmMùng Chụp, Màn Chụp Tự Bung Không Đáy Chống Muỗi Cao Cấp Thương Hiệu FUNU - Hàng Chính Hãng FUNU (Sản Xuất 100% Tại Việt Nam).Vải tuyn mềm, mịn, bền chắc đảm bảo chất lượn...",161500,170000,,8500,5,360,,available,,1000,1000,,839837,FuNu
90531871,4758446326246,"  Đèn bàn không chỉ là một dụng cụ cần thiết cho việc học tập, cũng như làm việc của bạn mà còn là một vật trang trí không thể thiếu cho căn phòng của bạn. Đèn bàn Moontronics MT01 là một sản phẩm...",158900,190000,,31100,16,917,,available,,1000,1000,,4251381,Moontronics
3258989,1045985192974,"Điểm nổi bật:- Chiếu ngủ văn phòng được thiết kế bằng chất liệu nhựa chuyên dụng 2 lớp, bên dưới là lớp mút êm ái, bên trên là lớp bạc cách nhiệt tạo cảm giác thoải mái không nóng bức cho những buổi ...",41000,41000,,0,0,1047,,available,,1000,1000,,111461,OEM
213704080,6505871283509,Đặc điểm:• Kết cấu dạng lưới bên ngoài trong mờ hai màu từ dưới lên đỏ sẫm và màu hồng• Lớp lót màu hồng trong mờ và lớp lót giấy bạc• Ống hút PP màu hồng nhạt trong suốt• Logo Siren dập nổi ở mặt...,617500,650000,,32500,5,6,,available,,1000,1000,,423495,STARBUCKS
116726951,5065788315592,"GỐI CÔNG THÁI HỌC LÀ GÌCông thái học hay tiếng anh Ergonomic là thuật ngữ được ghép lại từ  2 từ của tiếng Hy Lạp, trong đó “ergon” có nghĩa là công việc, và “nomoi” có nghĩa là quy luật tự nhiên. Nh...",589000,1178000,,589000,50,330,,available,,1000,1000,,3955813,Ema
195852183,6345258326968,Bình giữ nhiệt bằng thép không gỉ LocknLock Jumbo Tumbler LHC4300 có:Dung tích bình lơn (900 ml) Quai xách chống trượt Miệng bình rộng dễ dàng cho đá vào và dễ dàng chùi rửa Có khay lọc ngăn đá ho...,434000,730000,,296000,41,106,,available,,1000,1000,,48077,LocknLock
110001215,6334612852198,"Bộ 20 miếng dán tường đi dây điện - kẹp cố định nút giữ luồn dây điệnNẹp Dây Điện,Kẹp Dây Điện dán tường cố định dây điện,giữ dây điện an toàn và tiện lợiPhân Loại :• Mỗi bộ sản phẩm gồm: 20 nút kẹ...",19000,29000,,10000,34,107,,available,,1000,1000,,111461,OEM
2119169,4204353763551,"  Bộ Cây Lau Nhà Lock&Lock Squeeze Flat Mop ETM471 thiết kế xô tứ giác thông minh, khe vắt vừa có thể vắt khô nước vừa loại các vết bẩn một cách dễ dàng.Thiết kế thùng chứa nước nhỏ gọn và san...",485000,979000,,494000,50,1135,,available,,1000,1000,,48077,LocknLock
1024190,4116222211578,"Bộ 3 Hộp Cơm Giữ Nhiệt Lock&Lock Mushroom LHC8025SLV - Bạc dùng để đựng thực phẩm, thích hợp để sử dụng hằng ngày.Bộ sản phẩm gồm: Hộp cơm 460ml, 2 hộp thức ăn 420ml và 280ml, 1 túi giữ nhiệt, 1...",549000,1007000,,458000,45,89,,available,,1000,1000,,48077,LocknLock
161020621,2828230402720,"Chuẩn bị đất trồng Cây bầu có thể trồng trên nhiều loại đất, tuy nhiên phát triển tốt nhất trên đất tơi xốp, độ phì cao, giàu dinh dưỡng, pH trong khoảng 6-7. Đất bạn có thể mua sẵn hoặc trộn đất vớ...",3000,3000,,0,0,3,,available,,1000,1000,,111461,OEM
188975478,3819939562916,"CHUÔNG CỬA KHÔNG DÂY THÔNG MINH CACAZI A20, 36 NHẠC CHUÔNG, KHOẢNG CÁCH THU PHÁT SÓNG TRONG 300M  ...",165000,165000,,0,0,2,,available,,1000,1000,,685485,CACAZI
99621372,4566919726066,"Bình giữ nhiệt Lock&Lock Belt Bottle LHC4267 490ml với quai xách kiểu dáng dây đai giúp dễ dàng mang đi.Tay cầm TPE ngăn nắp rơi ra và mất, dây đai cố định nắp trong khi uống.Nắp được giữ cố ...",235000,473000,,238000,50,1133,,available,,1000,1000,,48077,LocknLock
55900887,2112313292992,"THIẾT KẾ SANG TRỌNG - ĐẲNG CẤPChất liệu hợp kim nhôm đẳng cấp, chắc chắn và sang trọngCó thể gập ở 2 vị trí, linh hoạt, chiếu sáng tới vị trí làm việcBỀN BỈHệ thống 26 bóng đèn LED tiết kiệm n...",449000,499000,,50000,10,1016,,available,,1000,1000,,835483,eLights
107961500,3904766552668,Cấu trúc tường đôi: Ly Nhựa 2 Lớp LocknLock Double Wall Cold Cup Cherry Blossom 750ml HAP509 sử dụng vệ sinh hơn vì nước lạnh không bị ngưng tụ bên ngoài thành cốc.Miệng ly rộng: Dễ dàng vệ sinh bên...,129000,217000,,88000,41,981,,available,,1000,1000,,48077,LocknLock
45443981,3726233794062,Hạt Giống Đậu Rồng [ Nảy Mầm Cực Chuẩn ]Bán hạt giống Đậu rồngXuất xứ: Việt NamĐộ thuần: 99%Màu sắc: Màu xanhSố lượng hạt: 3 hạt (túi zip)Hạn sử dụng: 2 nămQuả dài: 10-15cmNơi trồng thích hợ...,5900,5900,,0,0,7,,available,,1000,1000,,111461,OEM
1918591,4964968185253,"Keo Dán Giày, Dây Nịt Đa Năng Selleys Kwik Grip là dòng keo kết dính đàn hôi, thích hợp cho việc dán các vật có bề mặt thấm nước và khống thấm nước, bề mặt đứng thẳng hoặc những bề mặt khó cố định.S...",29000,35000,,6000,17,475,,available,,1000,1000,,52977,Selleys
186256010,2595430081331,"** Ưu điểm:– Sản phẩm có đường may khéo léo, chắc chắn.– Màu sắc nổi bật, an toàn cho sức khỏe gia đình bạn.– Dùng để thay đổi cho không gian phòng ngủ thêm phong phú hoặc để dùng kèm với bộ cũ của...",38000,45000,,7000,16,22,,available,,1000,1000,,697923,LIDACO
191505971,4898846305750,Bình giữ nhiệt Lock&Lock Maman Cup Vacuum Bottle - Thép không gỉ hợp vệ sinh và cấu trúc 2 lớp chân không giúp ngăn chặn việc đọng nước bên ngoài và giữ cho túi của bạn luôn sạch sẽ khi mang theo...,255000,515000,,260000,50,81,,available,,1000,1000,,48077,LocknLock
126725438,8006443189097,"Chất liệu: vải cách nhiệt (1 mặt mút xốp, 1 mặt tráng bạc) - viền vải không dệtÊm ái - gọn nhẹ, dễ dàng mang theo khi đi dã ngoại, văn phòng xếp gọn và vệ sinh dễ dàngCho giấc ngủ trưa ngon, không n...",39000,39000,,0,0,316,,available,,1000,1000,,5187537,GINGOOD
146887829,3696663027608,"Đèn Pixar, Đèn Bàn Học Chống Cận Thị, Đèn Đọc Sách LED, Đèn Làm Việc Bảo Vệ Mắt - Hàng Chính Hãng dododios  Đèn bàn DODODIOS PIXAR được chế tạo từ thép được sơn tĩnh điện cao cấp     Đèn bà...",149000,250000,,101000,40,287,,available,,1000,1000,,5272071,dododios
174618568,1085021483685,"Thùng rác thông minh cảm ứng tự động M&L B-JA-18 sẽ thay đổi khái niệm về thùng rác của bạn. Thùng rác thông minh M&L không còn là đồ dùng hôi hám, xấu xí bạn phải giấu đi trong không gian sin...",559000,945000,,386000,41,35,,available,,1000,1000,,5718283,M&L
127077945,6165473420713,"       Hạt giống dưa lưới chịu nhiệt, sản phẩm của Hạt Giống Rạng Đông   Quy cách: gói 10 hạt   Hướng dẫn trồng:   Gieo vào bầu 1hạt/ 1 bầu. Thời gian ươm khoảng 7-10 ngày (vụ thu đông), 15 ngà...",5000,5000,,0,0,0,,available,,1000,1000,,111461,OEM
201040328,4080016476690,- Bình giữ nhiệt LocknLock Riga Tumbler Vietnam Edition LHC4160 897ml có quai xách dễ dàng mang đi mọi nơi- Bộ lọc thép không gỉ và ngăn đá tràn khi uống- Miệng bình rộng dễ dàng vệ sinh- Ống hút ...,354000,715000,,361000,50,99,,available,,1000,1000,,48077,LocknLock
57999394,9466863791713,"** Bộ ga gối cotton Tici gồm: - 01 Ga/Drap bo thun theo kích thước theo yêu cầu- 02 Vỏ gối nằm kích thước 50 x 70 cm** Bộ ga gối Cotton tici ( hay còn gọi là cotton thô, hay cotton đũi). Chất liệu vải...",189000,229000,,40000,17,407,,available,,1000,1000,,697923,LIDACO
169978766,5015419822189,THÔNG TIN SẢN PHẨM- Tên sản phẩm: Túi Hút Chân Không Deli- Chất liệu: Nhựa Cao cấp- Kích thước: Size S: 60 x 40 cm (Dài x Rộng)Size M: 70 x 50 cm (Dài x Rộng)Size L: 80 x 60 cm (Dài x Rộng)Size ...,18000,32220,,14220,44,129,,available,,1000,1000,,46703,Deli
47108061,5633038506180,Giới thiệu Bộ 100 túi hút chân không một mặt nhámTúi PA/PE hút chân không là các túi dùng để bảo quản thực phẩm bên trong và được xử lý theo công nghệ rút chân không bằng máy hút chân không chuyên dụ...,61700,65000,,3300,5,111,,available,,1000,1000,,111461,OEM
176598081,9413822411143,Bình giữ nhiệt LocknLock Metro Two Way 475ml đi kèm với một nắp thuận tiện để uống trong văn phòng và một nắp to-go kín hơi dễ dàng mang đi.Bạn có thể tháo rời nắp giữa để bình trở nên gọn nhẹ hơn....,300000,605000,,305000,50,167,,available,,1000,1000,,48077,LocknLock
202611094,3025474464370,Bộ 2 hộp Thủy Tinh Chịu Nhiệt Lock&Lock LCB425 + LCB425C dễ dàng nấu ăn với lò vi sóng.Có thể giữ thực phẩm tươi lâu hơn nhờ công nghệ Lock & Lock Air-tight;Không tự nổ và không gây độc hại ...,179000,387000,,208000,54,14,,available,,1000,1000,,48077,LocknLock
1398733,1012204019527,"Cây Lau Nhà Dạng Đứng Lock&Lock ETM461 ứng dụng công nghệ hơi nước hiện đại giúp bạn dễ dàng lau chùi những vết bẩn cứng đầu nhất trên sàn nhà chỉ với một lần lau, tiết kiệm thời gian cũng như...",277000,539000,,262000,49,0,,available,,1000,1000,,48077,LocknLock
183907622,5312017804399,"LĂN BỤI QUẦN ÁO, GHẾ SOFE- Dùng để lau bụi dính ở quần áo, đặc biệt các chất dính len, dạ bị dính do giặt chung các loại quần áo với nhau.- Đặc biệt nhà ai nuôi chó mèo tì cực kỳ hữu hiệu.- Cây lăn...",49000,85000,,36000,42,60,,available,,1000,1000,,4820811,PEAFLO
58357614,3432364889774,"1. Đặc điểm nổi bậc của bắt muỗi, ruồi và côn trùng hiệu Con Dơi - Tiêu diệt muỗi cả ban ngày và ban đêm ( đèn bắt muỗi thông thường không bắt được muỗi ban ngày) muỗi ban ngày mới thực sự là muỗi độc...",420000,420000,,0,0,905,,available,,1000,1000,,304627,CON DƠI
21441057,9944927310617,"Chảo Chống Dính Đá Sunhouse SBD18 được tin dùng bởi công năng tuyệt vời, độ chống dính cao cùng với kết cấu bền chắc. Bề mặt phủ lớp đá Marble khiến cho tổng quan sản phẩm đẹp mắt, ấn tượng và nổi bật...",186000,283000,,97000,34,734,,available,,1000,1000,,41048,Sunhouse
55630076,8809518360598,"Miếng lót ly vô cùng độc đáo được làm từ đá Diatomite siêu thấm nước.Ngoài chức năng siêu thấm, đế lót ly được in thêm các hoạ tiết siêu dễ thương.Là sản phẩm rất đáng có trên bàn làm việc của bạn....",55000,55000,,0,0,335,,available,,1000,1000,,111461,OEM
156165766,5192592687203,"Ổ Cắm Du Lịch Đa Năng Thông Minh Phích Cắm Chuyển Đổi Bugu HHT931 1, Thông số kỹ thuật: Thương hiệu: buguModel: HHT931Loại: Công cụ chuyển đổi ổ cắm đa quốc giaSố chấu: 3D...",118680,129000,,10320,8,41,,available,,1000,1000,,568631,Bugu
48045630,8111055666089,Panasonic là thương hiệu nổi tiếng thế giới chuyên sản xuất các dòng pin gắn trong. Mang lại hiệu suất tuyệt vời cho thiết bị đồng thời bảo vệ môi trườngVới công nghệ NHẬT BẢN Pin CR2032 sẽ mang lại ...,90000,100000,,10000,10,553,,available,,1000,1000,,18804,Panasonic
17423771,1693054414764,Hàng năm có khoảng 600 triệu viên pin bị vứt bỏ. Số lượng pin này xếp dài ra sẽ tương đương quãng đường từ Anh sang Úc!Pin có nhiều loại với nhiều kích thước khác nhau: Có viên pin có kích thước chỉ n...,75000,90000,,15000,17,592,,available,,1000,1000,,18804,Panasonic
188375839,2369634218983,"Khăn tắm Khăn lau mặt Cotton 100% Mềm Êm Dày dặn Màu trơn Nhấn viền họa tiết 74x33cmChi tiết sản phẩm:Kích thước: 74x33cmMàu sắc: Xanh ngọc, Trắng, Hồng, Xanh dương, Ghi nhạt, Xanh thanTrọn lượng:...",53000,53000,,0,0,37,,available,,1000,1000,,4554495,CHIKIGON
120759154,6781039495608,  ...,25000,25000,,0,0,116,,available,,1000,1000,,111461,OEM
182971940,7966240754631,Bình giữ nhiệt LocknLock có 2 nắp thay thế New Clip Tumbler 540ml LHC4279 có cấu trúc tường đôi cho hiệu quả cách nhiệt và giữ mát xuất sắc cũng như ngăn ngừa được việc đọng nước ngoài thành bình.Ha...,257000,520000,,263000,51,186,,available,,1000,1000,,48077,LocknLock
192120961,6164388733925,"Túi Zip Lụa Nhựa CPE Trong Mờ Có Khóa Kéo Đa NăngTúi zip lụa được làm từ nhựa CPE dẻo dai, bền chắc có thể tái sử dụng nhiều lần trong lâu dài. Túi có khóa kéo nhựa kín giúp bảo quản được nhiều vật d...",41000,41000,,0,0,29,,available,,1000,1000,,5706641,NAVIVU
71924330,8126161754070,"Bộ Chổi Quét Nhà Gồm 1 Cây Chổi + 1 Dụng Cụ Hốt Lock&Lock ETM465 là sản phẩm vô cùng tiện ích, thay thế cho cây chổi quét bình thường thân inox nhỏ , nhẹ dễ luồn lách nhẹ nhàng đến các khe hẹp: bà...",254000,428000,,174000,41,326,,available,,1000,1000,,48077,LocknLock
52504270,2215202432605,"Chiếu Mây Điều Hòa Cao CấpChiếu mây điều hòa hay còn gọi là chiếu sợi mây điều hòa nguyên bản được làm từ chất liệu là các sợi mây đan vào nhau, mặt dưới là lớp lót bằng vải không, viền xung quanh ch...",195000,229000,,34000,15,612,,available,,1000,1000,,697923,LIDACO
182786661,1118186167166,"Bạn muốn ngủ một giấc thật sâu và dài, sau một tuần làm việc mệt mỏi nhưng bị làm phiền bởi ánh sáng mặt trời, bạn hãy dùng ngay bịt mắt ngủ này để giúp giấc ngủ của bạn được kéo dài thêm nhé.Miếng b...",61000,115000,,54000,47,35,,available,,1000,1000,,4401579,SHOFUKA
185653590,3926774620116,"- Chăn hè thường có màu sắc dịu mát, tươi trẻ, là sự lựa chọn thông minh cho phòng ngủ của bạn. Chăn còn có thiết kế nhỏ gọn, tiện dụng cho di chuyển, mang đến nơi làm việc như văn phòng, công sở dùng...",229000,289000,,60000,21,47,,available,,1000,1000,,697923,LIDACO
892121,8567702194984,"Pin Max 8 + 4 Viên Energizer E91 BP8+4 AA là sản phẩm có thể sử dụng cho các loại máy ảnh, điều khiển từ xa, đèn Pin, máy chơi game không dây, máy nghe nhạc MP3 và các thiết bị kỹ thuật số cá nhân kh...",136800,136800,,0,0,294,,available,,1000,1000,,19312,Energizer
117353723,8574020376721,"Chiếu ngủ văn phòng cao cấp Chất liệu nhựa 2 lớp: lớp mút và lớp bạc êm ái Gọn nhẹ, dễ dàng mang theo khi đi dã ngoại, văn phòng Xếp gọn và vệ sinh dễ dàng Cho giấc ngủ trưa ngon, không nóng bức  ...",40000,40000,,0,0,272,,available,,1000,1000,,293033,Krishna
32178075,8059080958444,"  Bộ Nồi Inox 4 Đáy Nagakawa NAG1304 bao gồm 3 nồi với 3 kích thước: 160mm; 200mm; 240mm.Thiết kế thân nồi thẳng cao, đơn giản, rất đẹp mắt với màu inox sáng bóng, được làm bằng chất liệu inox cao...",403000,700000,,297000,42,294,,available,,1000,1000,,110935,Nagakawa
71111080,1339941558226,"Kệ Để Giày Dép Inox 5 Tầng Chính Hãng Amalife, Giá Để Giày Inox 5 Tầng - Chọn MàuMô Tả Chi Tiết - Kệ Để Giày Dép 5 Tầng Chính Hãng Amalife - Chọn Màu:Kệ Để Giày Dép Inox 5 Tầng, Giá Để Giày Inox...",127000,169000,,42000,25,259,,available,,1000,1000,,456351,Amalife
191918107,1171170118704,Dung tích bình lớn Bình lắc LocknLock Balance Shake It Bottle HAP949 với dung tích bình 800ml giúp cung cấp đầy đủ lượng nước cho cơ thể. Thang đo lường Vạch chia dung tích trên thân bình cho phép ...,133000,267000,,134000,50,41,,available,,1000,1000,,48077,LocknLock
201112268,9060045217250,"Thảm Nhà Bếp Siêu Thấm Dễ Dàng Vệ Sinh, Thảm Silicon 4 Lớp NAVIVU Đóng gói:  1 (một) thảm chùi chân silicon️ Tính năng Siêu hút nước nhanh Không bị ẩm Dễ dàng vệ sinh Chống trượt an toàn cho người d...",129000,129000,,0,0,7,,available,,1000,1000,,5706641,NAVIVU
